<?xml version="1.0" encoding="UTF-8"?>
<Potvrda_o_vakcinaciji xmlns="http://www.vakc-sistem.rs/potvrda-o-vakcinaciji"
    xmlns:xsi="http://www.w3.org/2001/XMLSchema-instance"
    xsi:schemaLocation="http://www.vakc-sistem.rs/potvrda-o-vakcinaciji portvrda_o_vakcinaciji.xsd" Sifra_potvrde="1525124">
    <Podaci_o_primaocu>
        <Ime>Marko</Ime>
        <Prezime>MarkoviÄ‡</Prezime>
        <Datum_rodjenja>1999-01-01</Datum_rodjenja>
        <Pol>Musko</Pol>
        <JMBG>0101999103012</JMBG>
    </Podaci_o_primaocu>
    <Podaci_o_vakcini>
        <Naziv>Pfizer</Naziv>
        <Zdravstvena_ustanova>Dom Zdravlja "Novi Sad"</Zdravstvena_ustanova>
        <Doze>
            <Doza Redni_broj="1">
                <Datum>2021-10-08</Datum>
                <Serija>512512</Serija>
            </Doza>
        </Doze>
        <DatumNaredneDoze>2021-10-29</DatumNaredneDoze>
    </Podaci_o_vakcini>
    <Podaci_o_potvrdi>
        <Datum_izdavanja>2021-12-08</Datum_izdavanja>
        <QRCode>http://www.vakc-sistem.rs/qr-codes/Qr2</QRCode>
    </Podaci_o_potvrdi>
</Potvrda_o_vakcinaciji>